Text,Category,,
draw,draw,,
draw flower,draw,,
draw a tree,draw,,
draw boat,draw,,
please draw a house,draw,,
can you able to draw the sun,draw,,
please draw something for me,draw,,
can you make a drawing,draw,,
i want you to draw,draw,,
could you sketch something,draw,,
create a drawing on the screen,draw,,
i’d like you to start drawing,draw,,
go ahead and draw,draw,,
make a quick sketch please,draw,,
draw whatever you like,draw,,
please start the drawing now,draw,,
can you make a doodle,draw,,
draw a picture for me,draw,,
do a drawing,draw,,
please begin sketching,draw,,
make a random drawing,draw,,
go ahead and draw anything,draw,,
start drawing now please,draw,,
can you sketch something simple,draw,,
please create a simple drawing,draw,,
draw on the canvas,draw,,
i’d love to see you draw,draw,,
go ahead and make a sketch,draw,,
begin the drawing session,draw,,
could you draw something nice,draw,,
draw something random,draw,,
start a new drawing,draw,,
make a drawing for me please,draw,,
i want to watch you draw,draw,,
begin to sketch now,draw,,
please create a quick sketch,draw,,
can you start a drawing,draw,,
just draw anything you want,draw,,
make a new drawing please,draw,,
"go ahead, start sketching",draw,,
start a new sketch session,draw,,
can you make some art,draw,,
create something on screen,draw,,
i want to see a drawing,draw,,
start painting something,draw,,
draw freely whatever comes to mind,draw,,
please begin making a drawing,draw,,
go draw something interesting,draw,,
can you open the drawing window,draw,,
initiate a drawing,draw,,
start making a doodle,draw,,
can you show me how you draw,draw,,
please draw right now,draw,,
begin a quick sketch,draw,,
i’d like you to create a visual drawing,draw,,
delete,delete,,
delete flower,delete,,
delete a tree,delete,,
delete boat,delete,,
please delete a house,delete,,
can you able to delete the sun,delete,,
please delete that,delete,,
can you remove it,delete,,
erase what i just did,delete,,
delete the last thing,delete,,
remove that part,delete,,
can you clear it out,delete,,
please get rid of it,delete,,
i want to delete something,delete,,
can you undo that drawing,delete,,
delete whatever i just made,delete,,
remove the last thing i drew,delete,,
clear what’s on the screen,delete,,
delete the previous work,delete,,
can you erase that section,delete,,
please remove this drawing,delete,,
get rid of the last one,delete,,
delete that item,delete,,
can you clear everything,delete,,
remove it please,delete,,
erase the recent change,delete,,
delete what’s visible now,delete,,
please remove the last action,delete,,
i want to clear the canvas,delete,,
delete it right now,delete,,
remove the thing you just drew,delete,,
can you erase the current one,delete,,
delete that for me please,delete,,
remove all of it,delete,,
clear everything on screen,delete,,
please delete that quickly,delete,,
can you remove the last update,delete,,
i want you to erase it,delete,,
delete something for me,delete,,
clear the canvas please,delete,,
remove the old drawing,delete,,
delete that now,delete,,
erase the mistake,delete,,
can you delete it please,delete,,
please clear this up,delete,,
remove my last input,delete,,
delete it from the screen,delete,,
erase it right away,delete,,
can you delete that change,delete,,
remove the most recent one,delete,,
delete the content,delete,,
please erase what’s there,delete,,
get rid of the last action,delete,,
clear it off the screen,delete,,
delete that drawing,delete,,
remove the last operation,delete,,
redo,redo,,
redo flower,redo,,
redo a tree,redo,,
redo boat,redo,,
please redo a house,redo,,
can you able to redo the sun,redo,,
please redo that,redo,,
can you bring it back,redo,,
restore what i just removed,redo,,
undo the delete,redo,,
redo the last action,redo,,
bring back what i deleted,redo,,
please recover it,redo,,
get back the thing i erased,redo,,
redo my last step,redo,,
can you return what was deleted,redo,,
put it back on screen,redo,,
restore the last one,redo,,
redo what i did before,redo,,
please bring back the drawing,redo,,
revert that delete,redo,,
can you reapply my last action,redo,,
i want to bring back what i deleted,redo,,
redo the previous step,redo,,
please return it,redo,,
get the deleted thing back,redo,,
can you restore the last change,redo,,
bring the last item back,redo,,
please redo what was undone,redo,,
restore it right now,redo,,
can you re-do that delete,redo,,
bring back the previous drawing,redo,,
redo my delete command,redo,,
i want to see the deleted one again,redo,,
recover what was erased,redo,,
put the deleted content back,redo,,
please redo my previous action,redo,,
bring that back for me,redo,,
can you restore what was gone,redo,,
undo the last removal,redo,,
redo what i undid,redo,,
please get back the last thing,redo,,
return the erased part,redo,,
redo that delete action,redo,,
bring back my previous sketch,redo,,
please restore the last item,redo,,
get it back on canvas,redo,,
can you re-do that operation,redo,,
restore my last deletion,redo,,
bring it back immediately,redo,,
please redo previous delete,redo,,
redo what was removed earlier,redo,,
can you return the last erased drawing,redo,,
recover that last deleted thing,redo,,
please restore my previous change,redo,,
redo the delete i just did,redo,,
what’s the weather like today,unknown,,
tell me a joke about artists,unknown,,
how are you doing,unknown,,
open youtube for me,unknown,,
what time is it now,unknown,,
play some music please,unknown,,
can you help me with my homework,unknown,,
who is the president of india,unknown,,
"i’m hungry, order pizza",unknown,,
show me my saved files,unknown,,
close all tabs,unknown,,
tell me something funny,unknown,,
what’s your name,unknown,,
can you dance,unknown,,
i just spilled coffee,unknown,,
this app looks cool,unknown,,
you’re drawing too slow,unknown,,
make it rain on screen,unknown,,
can you clean my desktop,unknown,,
who made you,unknown,,
what version are you running,unknown,,
i need a break,unknown,,
stop doing anything,unknown,,
switch to dark mode,unknown,,
show me the logs,unknown,,
i’m just testing,unknown,,
that was funny,unknown,,
restart the program,unknown,,
take a screenshot,unknown,,
how do i save my work,unknown,,
open calculator,unknown,,
sing a song,unknown,,
show me your code,unknown,,
my mouse isn’t working,unknown,,
can you paint a real picture,unknown,,
what color do you like,unknown,,
open microsoft word,unknown,,
i’m bored,unknown,,
what is two plus two,unknown,,
launch notepad,unknown,,
save and exit,unknown,,
switch window,unknown,,
how to draw a real house,unknown,,
tell me a fun fact,unknown,,
print the screen,unknown,,
stop drawing,unknown,,
who built this software,unknown,,
good morning,unknown,,
open settings,unknown,,
just kidding,unknown,,
sdfs,unknown,,
.,unknown,,
hello,unknown,,
hi,unknown,,
who,unknown,,
